{
  "schemaVersion": "1.0",
  "kind": "docx-page-normalization-result",
  "requestId": "junior-image-backed-page-normalization",
  "subjectPack": "junior-physics-answer",
  "fixtureKind": "synthetic_fixture",
  "sourceRequestSha256": "bc0af57228877417082d59e84e651b94d9b0e780096b44b264a3e7f78c5f7347",
  "sourceDocument": {
    "artifactRef": "junior-image-backed-page.docx",
    "rawByteSha256": "910a46a2e1dcc4cd0934df78670790b5af2a232031909367fbe962d5955fa519",
    "sourceKind": "docx"
  },
  "adapterProfile": "image_backed_single_page_only",
  "packageInspection": {
    "entryCount": 18,
    "uncompressedBytes": 957012,
    "documentPart": "word/document.xml",
    "relationshipId": "rId9",
    "imagePart": "word/media/image1.png",
    "imageExtentEmu": {
      "cx": 5943600,
      "cy": 3820886
    }
  },
  "pages": [
    {
      "pageRef": "docx-page-001",
      "sourceImagePart": "word/media/image1.png",
      "rawByteSha256": "1ae505c96799bd36f5b18bc02aea8ab2560890b3d27989c6282b94c2c5ca8dd8",
      "decodedRgbPixelSha256": "4cfa63971d77ae3c8777784f72c6f5fec995e12871d5dc48674c2db2689100bd",
      "normalizedPage": {
        "schemaVersion": "1.0",
        "kind": "normalized-page",
        "pageId": "junior-image-backed-page-1",
        "sourceDocument": "junior-image-backed-page.docx",
        "sourceKind": "docx",
        "pageNumber": 1,
        "imagePath": "page-001.png",
        "pixelSize": {
          "width": 560,
          "height": 360
        },
        "dpi": 96,
        "renderScales": [
          1
        ],
        "preprocessing": {
          "orientationDegrees": 0,
          "deskewApplied": false,
          "denoiseApplied": false,
          "trimApplied": false,
          "perspectiveCorrectionApplied": false
        },
        "regionRefs": [],
        "ocrRefs": [],
        "layoutRefs": [],
        "qualityFlags": [],
        "generatedAt": "2026-07-31T15:00:00Z"
      }
    }
  ],
  "summary": {
    "pageCount": 1,
    "embeddedImageCount": 1
  },
  "engineProvenance": {
    "engineKind": "local_runtime",
    "engineId": "python-stdlib-opc-ooxml-image-page-adapter",
    "engineVersion": "1.0.0",
    "liveProvider": false,
    "cloudEgress": false
  },
  "dispositions": {
    "adapterDisposition": "image_backed_single_page_only",
    "layoutDisposition": "not_reconstructed",
    "bodyTextDisposition": "not_extracted",
    "tableDisposition": "not_supported",
    "ommlDisposition": "not_supported",
    "paginationDisposition": "single_page_declared_shape_only",
    "regionDisposition": "not_generated",
    "ocrDisposition": "not_attempted",
    "trackDisposition": "not_integrated",
    "answerDisposition": "not_generated",
    "requiresHumanReview": true,
    "acceptanceDisposition": "not_accepted",
    "controlsDisposition": "not_verified",
    "eligible": false,
    "optimizationCandidateRefs": []
  },
  "generatedAt": "2026-07-31T15:00:00Z"
}
